AuthorYear,Authors,Title,Journal,Year,URL,Abstract,Relevant,Experiment,SourceType,SourceTypeNEW,Original,DataSourceReference,Country,YearsCovered,VarsSocioDemographic,VarPolBehavior,VarsOffices,VarsDistrict,VarsInteresting,Questions?
Fraga2016,"Fraga, Bernard L.",Candidates or Districts? Reevaluating the Role of Race in Voter Turnout,AJPS,2016,http://www.jstor.org/stable/24583053,"Leading theories of race and participation posit that minority voters are mobilized by co-ethnic candidates. However, past studies are unable to disentangle candidate effects from factors associated with the places from which candidates emerge. I reevaluate the links between candidate race, district composition, and turnout by leveraging a nationwide database of over 185 million individual registration records, including estimates for the race of every voter. Combining these records with detailed information about 3,000 recent congressional primary and general election candidates, I find that minority turnout is not higher in districts with minority candidates, after accounting for the relative size of the ethnic group within a district. Instead, Black and Latino citizens are more likely to vote in both primary and general elections as their share of the population increases, regardless of candidate race.",yes,no,institute; government,"government, original",,Catalist ILC https://www.catalist.us/; Federal Election Commission (FEC) htftp://wvww.foec.gtov/epubrrec/selectionrersults.shctmil,US House and Senate,"2006, 2008, 2010",yes,no,yes,yes,co-ethnic candidacy,
Fukumoto2009,"Fukumoto, Kentaro",Systematically Dependent Competing Risks and Strategic Retirement,AJPS,2009,http://www.jstor.org/stable/25548149,"In many applications of survival analysis, the risk of an event occurring for one reason is dependent on the risk of the same event occurring for another reason. For example, when politicians suspect they might lose an election, they may strategically choose to retire. In such situations, the often-used multinomial logit model suffers from bias and underestimates the degree of strategic retirement, for example, to what extent poor prior electoral performance diminishes electoral prospects. To address this problem, the present article proposes a systematically dependent competing-risks (SDCR) model of survival analysis. Unlike the frailty model, the SDCR model can also deal with more than two risks. Monte Carlo simulation demonstrates how much the SDCR model reduces bias. Reanalysis of data on U.S. congressional careers (Box-Steffensmeier and Jones 2004) documents the strategic retirement of representatives, indicating that electoral pressure is more effective at turning out incumbents than previously recognized.",yes,no,scholarly,scholarly,,"Box-Steffensmeier, Janet M., and Bradford S. Jones. 1997. ""Time Is ofthe Essence: Event History Models in Political Science."" American Journal of Political Science 41 (4): 1414-61.",US House ,1950-1976,no,yes,yes,no,,
GERALD2010,"GERALD, G. A. M. M. KOUSSER, T. H. A. D.",Broad Bills or Particularistic Policy? Historical Patterns in American State Legislatures,APSR,2010,http://www.jstor.org/stable/27798544,"When do lawmakers craft broad policies, and when do they focus on narrow legislation tailored to a local interest? We investigate this question by exploring historical variation in the types of bills produced by American state legislatures. Drawing on a new database of 165,000 bills--covering sessions over 120 years in thirteen different states--we demonstrate the surprising prominence of particularistic bills affecting a specific legislator's district. We then develop and test a theory linking the goals of legislators to their propensity to introduce district bills rather than broad legislation. We find that, consistent with our predictions, politicians are more likely to craft policies targeted to a particular local interest when a legislature is dominated by one party or when it pays its members relatively high salaries. These findings provide empirical support for Key's (1949) thesis that one-party politics descends into factionalism and undermines the making of broad public policy.",maybe,no,scholarly,scholarly,,"Burns, Nancy, and Gerald Gamm. 1997. ""Creatures of the State: State Politics and Local Government, 1871-1921. Urban Affairs Review 33: 59-96",US House,1881-1997,yes,yes,yes,yes,,
Giger2016,"Giger, Nathalie Kl{\u}ver Heike""",Voting Against Your Constituents? How Lobbying Affects Representation,AJPS,2016,https://www.jstor.org/stable/24583058,"Citizens delegate the representation of their political preferences to members of Parliament (MPs), who are supposed to represent their interests in the legislature. However, MPs are exposed to a variety of interest groups seeking to influence their voting behavior. We argue that interest groups influence how MPs cast their vote in Parliament, but that this effect varies across groups. While lobbying by sectional groups provides incentives for MPs to defect from their constituents, we expect that cause groups in fact strengthen the link between MPs and their voters. We test our argument based on an innovative study of 118 Swiss public referenda, which allows for directly comparing voter preferences with legislative voting of 448 MPs on these issues. Drawing on a multilevel regression analysis, this study shows that interest groups considerably affect the link between MPs and their voters. Our findings have important implications for our understanding of political representation.",yes,no,scholarly,scholarly,,"Stadelmann, David, Marco Portmann, and Reiner Eichenberger. 2013. ""Quantifying Parliamentary Representation of Con stituents' Preferences with Quasi-Experimental Data."" Jour nal of Comparative Economics 41(1): 170-80.",Switzerland,"1999, 2006, 2009",no,yes,yes,no,,
Gillion2012,"Gillion, Daniel Q.",Protest and Congressional Behavior: Assessing Racial and Ethnic Minority Protests in the District,JOP,2012,http://www.jstor.org/stable/10.1017/s0022381612000539,"Although minority protest is often characterized as an effective form of political participation, previous research has been unsuccessful in establishing a direct link between protest activity and congressional support for minority interests. However, the shortcoming of the existing literature is related to an analytical focus at the aggregate level, where only the passage of congressional legislation and national-level protest events are considered. By linking district-level minority protest actions to individual roll-call votes on race, I hypothesize that minority activism can indicate constituency preferences and inform legislators' votes. This analytical approach provides a more nuanced understanding of the influence that citizens' behavior has on congressional policy. Using protest data and congressional roll-call votes from the 87th to the 101st Congress, the empirical analysis demonstrates that representatives are attuned to the social conditions of their district and use minority protest as an informative cue that shapes their congressional voting behavior.",yes,no,institute,institute,,"Dynamics of Collective Action Database, New York Times Minority Protest Reporting, 1960-1995",US House,1960- 1995,yes,yes,no,no,,
Griffin2012,"Griffin, John D. Newman, Brian","Voting Power, Policy Representation, and Disparities in Voting's Rewards",JOP,2012,http://www.jstor.org/stable/10.1017/s0022381612000862,"Reelection-minded officials have motivations to represent some of their constituents more than others when casting roll-call votes. In particular, reelection seekers have incentives to appeal to those with greater ``voting power'' (Bartels 1998): those who are likely to vote, are not strongly predisposed to vote for one of the parties, and are members of large groups within a particular constituency. We present two novel findings stemming from these incentives. First, we find that those with greater voting power tend to enjoy better policy representation. Second, the rewards of voting are greater for those belonging to groups with more voting power. Since voting power varies across racial/ethnic and income lines, these findings hold significant normative implications.",yes,no,institute,"institue, scholarly",,Congressional Quarterly Dataset; American Association of University Women; 2000 and 2004 National Annenberg Election Surveys (NAES),US House,"2001-2002; 2004, 2005-2006, 2007-2008",yes,yes,no,no,,
GRIFFIN2012a,"GRIFFIN, J. O. H. N. D. NEWMAN, B. R. I. A. N. WOLBRECHT, C. H. R. I. S. T. I. N. A.",A Gender Gap in Policy Representation in the U.S. Congress?,LSQ,2012,http://www.jstor.org/stable/41719831,"In the first article to evaluate the equality of dyadic policy representation experienced by women, we assess the congruence between U.S. House members' roll-call votes and the policy preferences of their female and male constituents. Employing two measures of policy representation, we do not find a gender gap in dyadic policy representation. However, we uncover a sizeable gender gap favoring men in districts represented by Republicans, and a similarly sizeable gap favoring women in districts represented by Democrats. A Democratic majority further improves women's dyadic representation relative to men, but having a female representative (descriptive representation) does not.",yes,no,institute,scholarly,,2004 National Annenberg Election Study (NAES) Rolling Cross Section,US House ,2005-2006,yes,yes,yes,yes,,
GRIMMER2012,"GRIMMER, J. U. S. T. I. N. MESSING, S. O. L. O. M. O. N. WESTWOOD, S. E. A. N. J.",How Words and Money Cultivate a Personal Vote: The Effect of Legislator Credit Claiming on Constituent Credit Allocation,APSR,2012,http://www.jstor.org/stable/23357705,"Particularistic spending, a large literature argues, builds support for incumbents. This literature equates money spent in the district with the credit constituents allocate. Yet, constituents lack the necessary information and motivation to allocate credit in this way. We use extensive observational and experimental evidence to show how legislators' credit claiming messages---and not just money spent in the district---affect how constituents allocate credit. Legislators use credit claiming messages to influence the expenditures they receive credit for and to affect how closely they are associated with spending in the district. Constituents are responsive to credit claiming messages---they build more support than other nonpartisan messages. But contrary to expectations from other studies, constituents are more responsive to the total number of messages sent rather than the amount claimed. Our results have broad implications for political representation, the personal vote, and the study of U.S. Congressional elections.",yes,yes,scholarly; original,scholarly; original,,"Corporative Congressional Election Study; Grimmer, Justin. A Bayesian hierarchical topic model for political texts: Measuring expressed agendas in Senate press releases. 2010, Oxford University Press.",US House and Senate,2005-2010,no,yes,no,yes,,
Grimmer2013,"Grimmer, Justin Powell, Eleanor Neff",Congressmen in Exile: The Politics and Consequences of Involuntary Committee Removal,JOP,2013,http://www.jstor.org/stable/10.1017/s0022381613000704,"We show how preferred committee assignments act as an electoral subsidy for members of Congress---empowering representatives' legislative careers. When holding preferred assignments, legislators are free to focus on legislative activity in Washington, DC. But when the subsidy is removed, legislators are forced to direct attention to the district. To test our theory of legislative subsidy, we exploit committee exile---the involuntary removal of committee members after a party loses a sizable number of seats. Legislators are selected for exile using members' rank on the committee, causing exiled and remaining legislators to appear strikingly similar. Using exile, we show that it has only limited electoral consequences, but this is partly due to compensatory efforts. Exiled legislators shift attention away from Washington and towards the district: they raise and spend more money for reelection, author less legislation, are absent for more days of voting, and vote with their party less often.",yes,no,scholarly,scholarly,,"Nelson, Garrison. 2011. ‘‘Committees in the U.S. Congress, 1947–92, 80th-102nd Congresses.’’ Accessed August 11, 2011. http://web.mit.edu/17.251/www/data_page.html.; Stewart, Charles, III and Jonathan Woon. 2011. ‘‘Congressional Committee Assignments, 103rd to 112th Congresses, 1993–2011: House of Representatives.’’ August 11, 2011. http://web.mit.edu/17.251/www/data_page.html.
",US House,1993-2011,no,yes,yes,yes,committee exile,
Grimmer2013a,"Grimmer, Justin",Appropriators not Position Takers: The Distorting Effects of Electoral Incentives on Congressional Representation,AJPS,2013,http://www.jstor.org/stable/23496643,"Congressional districts create two levels of representation. Studies of representation focus on a disaggregated level: the electoral connection between representatives and constituents. But there is a collective level of representation---the result of aggregating across representatives. This article uses new measures of home styles to demonstrate that responsiveness to constituents can have negative consequences for collective representation. The electoral connection causes marginal representatives---legislators with districts composed of the other party's partisans---to emphasize appropriations in their home styles. But it causes aligned representatives---those with districts filled with copartisans---to build their home styles around position taking. Aggregated across representatives, this results in an artificial polarization in stated party positions: aligned representatives, who tend to be ideologically extreme, dominate policy debates. The logic and evidence in this article provide an explanation for the apparent rise in vitriolic debate, and the new measures facilitate a literature on home styles.",yes,no,scholarly,scholarly,,"Lax, Jeffrey, Phillips, Justin. How Should We Estimate Public Opinion in The States? American Political Science Review. 2009.",US House,2004,no,yes,no,yes,,
Grose2015,"Grose, Christian R. Malhotra, Neil Houweling, Robert Parks Van",Explaining Explanations: How Legislators Explain their Policy Positions and How Citizens React,AJPS,2015,http://www.jstor.org/stable/24583093,"Legislators claim that how they explain their votes matters as much as or more than the roll calls themselves. However, few studies have systematically examined legislators' explanations and citizen attitudes in response to these explanations. We theorize that legislators strategically tailor explanations to constituents in order to compensate for policy choices that are incongruent with constituent preferences, and to reinforce policy choices that are congruent. We conduct a within-subjects field experiment using U.S. senators as subjects to test this hypothesis. We then conduct a between-subjects survey experiment of ordinary people to see how they react to the explanatory strategies used by senators in the field experiment. We find that most senators tailor their explanations to their audiences, and that these tailored explanations are effective at currying support---especially among people who disagree with the legislators' roll-call positions.",yes,yes,original,original,,letter to senator,US Senate,2007-2008,no,yes,no,yes,,
Groseclose2010,"Groseclose, Tim Milyo, Jeffrey",Sincere Versus Sophisticated Voting in Congress: Theory and Evidence,JOP,2010,http://www.jstor.org/stable/10.1017/s0022381609990478,"An asymmetry exists in the empirical literature on sophisticated voting in Congress. All studies that find supporting evidence of sophisticated voting have been only piecemeal---that is, they examine only one or a few roll calls. In contrast, the studies that systematically study many roll calls conclude that sophisticated voting is, at best, very rare. We are aware of three such systematic studies---those by Poole and Rosenthal (1997), Wilkerson (1999), and Ladha (1994). While Ladha's study has gone relatively unnoticed, we reexamine his results and explain why they may be the most important of all empirical work on sophisticated voting. In addition, we introduce a theoretical model, and we show how it, along with some subtle aspects of the rules for voting in the House and Senate, provides a rational-choice explanation for the lack of sophisticated voting in Congress.",maybe,no,scholarly,scholarly,,"Ladha, Krishna K. 1994. ‘‘Coalitions in Congressional Voting.’’ Public Choice 78: 43–64.,  http://voteview.com",US House and Senate,,no,yes,no,no,sophisticated voting,
Hainmueller2015,"Hainmueller, Jens Hall, Andrew B. Snyder, James M.",Assessing the External Validity of Election RD Estimates: An Investigation of the Incumbency Advantage,JOP,2015,http://www.jstor.org/stable/10.1086/681238,"The regression discontinuity (RD) design is popular because it provides a design-based estimate of the incumbency advantage. However, the RD estimate is ``local'': it only identifies the effect in hypothetical elections with a 50-50 tie between the Democratic and Republican candidates. There is significant uncertainty and disagreement over the incumbency effect in safer districts away from this threshold. Indeed, mirroring the competing arguments in the theoretical literature, a survey of political scientists reveals that roughly equal numbers of respondents predict the effect to be either larger, smaller, or the same in less competitive districts. We employ a new method based on a validated conditional independence assumption that allows us to estimate the effect of incumbency in districts in a window around the threshold as large as 15 percentage points---that is, elections in which the winning candidate secured as much as 57.5% of the two-party vote. We find that the incumbency advantage is no larger or smaller in these less competitive cases.",yes,no,scholarly;governmental,scholarly,,"Ansolabehere, Stephen, and James M. Snyder Jr. 2002. “The Incumbency Advantage in US Elections: An Analysis of State and Federal Offices, 1942–2000.” Election Law Journal 1 (3): 315–38.",US ,1946-2012,no,no,yes,yes,,"author says data comes from ""many governmental sources"" but clarifies that data was compiled by Ansolabehere and Snyder"
Hansen2015,"Hansen, Eric R. Treul, Sarah A.",The Symbolic and Substantive Representation of LGB Americans in the US House,JOP,2015,http://www.jstor.org/stable/10.1086/682699,"As public opinion in the United States has shifted on questions of gay rights in the last decade, some members of Congress have likewise adjusted their behavior to address issues of concern to their lesbian, gay, and bisexual (LGB) constituents. We argue that the number of LGB constituents in a district affects the representatives' behavior. Although the size of the LGB population positively affects the substantive representation members provide to their LGB constituents, population is conditioned by majority public opinion on LGB issues in determining members' low-cost, symbolic representation of LGB constituents. More favorable majority attitudes toward the minority allow the member to provide more symbolic representation to LGB constituents through low-cost gestures and actions. Statistical tests examining the effects of minority population and public opinion on House members' voting records, bill sponsorships and cosponsorships, and caucus memberships from 2005 to 2011 provide support for our hypotheses.",yes,no,institute; government; self-coded,original,,Human Rights Campaign Congressional Scorecard; Former Caucus Chair Tammy Baldwin Website Database,US House,2005-2011,yes,yes,yes,yes,,
HARWARD2010,"HARWARD, B. R. I. A. N. M. MOFFETT, K. E. N. N. E. T. H. W.",The Calculus of Cosponsorship in the U.S. Senate,LSQ,2010,http://www.jstor.org/stable/20680267,"We investigated why a legislator would be willing to vote yea"" on final passage of a bill but would choose not to cosponsor that bill. We tested a series of hypotheses regarding the cosponsorship decisions of individual senators using a dataset that includes every major initiative that was introduced and received a floor vote in the Senate between 1975 and 2000. We found that senators are more likely to cosponsor bills when their preferences diverge from the Senate median but are closer to those of the bill's sponsor. Also senators are more likely to cosponsor bills when they sponsor a higher number of bills overall when they become more connected with colleagues",yes,no,scholarly,scholarly,,"inder, Sarah A. 1999. ""The Dynamics of Legislative Gridlock, 1947-96."" American Political Science Review 93: 519-3",US Senate,1975-2000,no,yes,yes,,,
HAYES2010,"HAYES, M. A. T. T. H. E. W. HIBBING, M. A. T. T. H. E. W. V. SULKIN, T. R. A. C. Y.","Redistricting, Responsiveness, and Issue Attention",LSQ,2010,http://www.jstor.org/stable/20680266,"We explored the extent to which legislators respond to redistricting-induced demographic shifts in their constituencies. Our analyses focused on the behavior of members of the House of Representatives who served in the terms preceding and following the redistricting that took place in the early 2000s (namely, the 107th and 108th Congresses). We investigated how demographic shifts relate to the content of legislators' subsequent agendas (the legislation that members introduce and cosponsor) and the nature of members' voting patterns (their interest group voting scores). Our results indicate that responsiveness is widespread, but important variation exists in the patterns for agenda activities and roll-call voting.",yes,no,scholarly,scholarly,,"Sulkin, Tracy. 2009. ""Campaign Appeals and Legislative Action."" Journal of Politics 71: 1093-1108.; Sulkin, Tracy, and Nathaniel Swigger. 2008. ""Is There Truth in Advertising? Campaign Ad Images as Signals about Legislative Behavior."" Journal of Politics 70: 232-44.",US House,2001-2004,yes,no,no,yes,,
Helmke2010,"Helmke, Gretchen",The Origins of Institutional Crises in Latin America,AJPS,2010,http://www.jstor.org/stable/27821949,"Institutional instability and interbranch crises pose a fundamental challenge to democracies in Latin America and the developing world more generally. Combining a standard game theoretic model of crisis bargaining with a unique dataset on courts, executives, and legislatures for 18 Latin American countries between 1985 and 2008, the article develops a strategic account of how interbranch crises emerge and evolve. In addition to providing the first systematic picture of the frequency, type, and location of interbranch crises for the region, the article demonstrates that the decision to initiate an interbranch crisis is influenced by the allocation of institutional powers, public support for the targeted branch, and the expectations of success based on recent experiences. Building on these results, the article identifies several novel directions for future research on institutional instability.",yes,no,original,original,,"Institutional Crises in Latin America (ICLA) Dataset, w","Argentina, Bolivia, Brazil, Chile, Colombia, Costa Rica, Dominican Republic, Ecuador, El Salvador, Guatemala, Honduras, Mexico, Nicaragua, Panama, Paraguay, Peru, Uruguay, Venezuela",1985-2008,no,yes,yes,yes,,
HERRNSON2011,"HERRNSON, P. A. U. L. S. MORRIS, I. R. W. I. N. L. MCTAGUE, J. O. H. N.",The Impact of Presidential Campaigning for Congress on Presidential Support in the U.S. House of Representatives,LSQ,2011,http://www.jstor.org/stable/23053240,"Presidential influence is partly a function of the partisan, economic, and international context within which the president governs. Presidents are, however, more than bystanders relying on the political milieu for policy opportunities. Recent scholarship demonstrates that presidents consciously influence this milieu and build political capital by campaigning for congressional candidates. We contribute to this literature by assessing the effects of presidential campaigning on legislative support for two presidents who governed under extremely dissimilar circumstances: Bill Clinton in the 106th Congress and George W. Bush in the 108th Congress. We find evidence of campaign effects on congressional policymaking during both administrations.",yes,no,government,scholarly,,Public Papers of the Presidents of the United States http://www.gpoaccess.gov/pubpaper,US House,"1998, 2002",no,no,yes,no,,pertains directly to presidents influence over house??
