AuthorYear,Authors,Title,Journal,Year,URL,Abstract,Relevant,Experiment,SourceType,SourceTypeNEW,Original,DataSourceReference,Country,YearsCovered,VarsSocioDemographic,VarPolBehavior,VarsOffices,VarsDistrict,VarsInteresting,Questions?
Baumann2017,"Baumann, Markus; Debus, Marc; KlingelhГ¶fer, Tristan",Keeping OneвЂ™s Seat: The Competitiveness of MP Renomination in Mixed-Member Electoral Systems,The Journal of Politics,2017,https://www.journals.uchicago.edu/doi/abs/10.1086/690945,"Mixed-member electoral systems are supposed to simultaneously produce coherent parties and ensure the representation of local interests. Whether these goals are achieved depends on the ability of parties and districts to control members of parliament (MPs). We regard the competitiveness of MPsвЂ™ bids for renomination as a crucial indicator of the degree to which MPs are punished when deviating from the interests of their principals. The theoretical account we develop makes the competitiveness of MP renomination conditional on the characteristics of the electoral system, the candidate selection regime, an MPвЂ™s parliamentary behavior, government status, and district characteristics. Corroborating our expectations, the analysis of the candidate selection processes in the run-up to the 2013 German Bundestag election shows that an increasing degree of ideological deviation from the party lineвЂ”as expressed in parliamentary speechesвЂ”results in a worse position on the party list for opposition MPs but does not affect the renomination of list candidates from the government camp or district candidates.",yes,no,"government, scholarly","government, scholarly",,"German Federal Election Office (Bundeswahlleiter);
 Bernauer, Julian, and Thomas Bräuninger. 2009. “Intra-party Preference Heterogeneity and FactionMembership in the 15th German Bundestag: A Computational Text Analysis of Parliamentary Speeches.” German Politics 18 (3): 385–402;
 Herzog, Alexander, and Kenneth Benoit. 2015. “The Most Unkindest Cuts: Speaker Selection and Expressed Government Dissent during Economic Crisis.” Journal of Politics 77 (4): 1157–75.",Germany,2009 - 2013,yes,yes,no,yes,intraparty competition at the district level,
Becher2018,"Becher, Michael; Stegmueller, Daniel; KГ¤ppner, Konstantin",Local Union Organization and Law Making in the US Congress,The Journal of Politics,2018,https://www.journals.uchicago.edu/doi/abs/10.1086/694546,"The political power of labor unions is a contentious issue in the social sciences. Departing from the dominant focus on membership size, we argue that unionsвЂ™ influence on national law making is based to an important degree on their local organization. We delineate the novel hypothesis that the horizontal concentration of union members within electoral districts matters. To test it, we draw on administrative records and map the membership size and concentration of local unions to districts of the US House of Representatives, 2003вЂ“12. We find that, controlling for membership size, representatives from districts with less concentrated unions have more liberal voting records than their peers. This concentration effect survives numerous district controls and relaxing OLS assumptions. While surprising for several theoretical perspectives, it is consistent with theories based on social incentives. These results have implications for our broader understanding of political representation and the role of groups in democratic politics.",maybe,no,"government, scholarly","government, scholarly",,"Department of Labor (LM forms);
 Bonica, Adam. 2014. “Ideology and Interests in the Political Marketplace.” American Journal of Political Science 57 (2): 294 –311.",US House,2003 - 2012,no,yes,no,yes,,"no clear source for LM forms and DW-scores NOMINATE, many different sources for other variables"
Carnes2016,"Carnes, Nicholas; Lupu, Noam",What Good Is a College Degree? Education and Leader Quality Reconsidered,The Journal of Politics,2016,https://www.journals.uchicago.edu/doi/abs/10.1086/683027,"Do people with more formal education make better political leaders? In this article we analyze cross-national data on random leadership transitions, data on close elections in the US Congress, and data on randomly audited municipalities in Brazil. Across a wide range of outcomes, we consistently find that college-educated leaders perform about the same as or worse than leaders with less formal education. Politicians with college degrees do not tend to govern over more prosperous nations, do not pass more bills, do not tend to do better at the polls, and are no less likely to be corrupt. These findings have important implications for how citizens evaluate candidates, how scholars measure leader quality, and how we think about the role of education in policy making.",yes,no,scholarly,scholarly,,"Brollo, Fernanda, Tommaso Nannicini, Roberto Perotti, and Guido Tabellini. 2013. “The Political Resource Curse.” American Economic Review 103 (5): 1759–96;
 Ferraz, Claudio, and Frederico Finan. 2008. “Exposing Corrupt Politicians.” Quarterly Journal of Economics 123 (2): 703–45;
 Ferraz, Claudio, and Frederico Finan. 2011. “Electoral Accountability and Corruption: Evidence from the Audits of Local Governments.” American Economic Review 101 (4): 1274–311;
 Besley, Timothy, Jose G. Montalvo, and Marta Reynal-Querol. 2011. “Do Educated Leaders Matter?” Economic Journal 121 (554): 205–27;
 Besley, Timothy, and Marta Reynal-Querol. 2011. “Do Democracies Select More Educated Leaders?” American Political Science Review 105 (3): 552–66;
 Lee, David S. 2008. “Randomized Experiments from Non-Random Selection in U.S. House Elections.” Journal of Econometrics 142 (2): 675–97","US House US Senate, Brazil",,yes,yes,no,no,,many sources of data each for different time periods
Carreri2017,"Carreri, Maria; Dube, Oeindrila","Do Natural Resources Influence Who Comes to Power, and How?",The Journal of Politics,2017,https://www.journals.uchicago.edu/doi/abs/10.1086/688443,"Do natural resources impair institutional outcomes? Existing work studies how natural resources influence the behavior of leaders in power. We study how they influence leadersвЂ™ rise to power. Our analysis focuses on oil price shocks and local democracy in Colombia, a country mired in civil conflict. We find that when the price of oil rises, legislators affiliated with right-wing paramilitary groups win office more in oil-producing municipalities. Consistent with the use of force to gain power, positive price shocks also induce an increase in paramilitary violence and reduce electoral competition: fewer candidates run for office, and winners are elected with a wider vote margin. Ultimately, fewer centrist legislators are elected to office, and there is diminished representation at the center. Our findings highlight how natural resources undermine democracy by distorting elections and suggest that conflict leaves the political sector vulnerable to the resource curse.",no,,,,,,Colombia,"1997, 2000, 2003, 2007",,,,,,"municipal officials, mayoral elections"
Cirone2018,"Cirone, Alexandra; Van Coppenolle, Brenda","Cabinets, Committees, and Careers: The Causal Effect of Committee Service",The Journal of Politics,2018,https://www.journals.uchicago.edu/doi/abs/10.1086/697252,"What is the value of committee service to an individual legislator? Self-selection and party control of appointments typically obscure this relationship. We estimate the causal effect of committee service on legislative behavior and parliamentary careers by exploiting a natural experiment in the French Third Republic (1870вЂ“1940). Yearly lotteries divided the legislature into groups that nominated members to the budget committee, and we use the random composition of these groups as an instrument for individual appointment. We find that appointment increased legislative entrepreneurship concerning budget legislation but not other types, suggesting that committee members acquire specialized expertise. Committee service also led to ministerial appointment but not to higher office that does not require specific policy expertise, such as party or senatorial positions. Finally, we discuss alternative mechanisms, including reputation effects, political networks, and distributional targeting via pork barrel legislation.",yes,no,"government, journalistic","government, journalistic",,"Journal officiel (Assemblée Nationale Française 1870–1910);
 the newspaper Le Matin, available from http://gallica.bnf.fr/;
 Assembl´ee Nationale http://archives.assemblee-nationale.fr/;
 Tableau des´elections la Chambre des d´eput´es",French Third Republic,1870 - 1940,yes,yes,yes,yes,career success; bill sponsorship,
Cooper2018,"Cooper, Jasper; Kim, Sung Eun; Urpelainen, Johannes",The Broad Impact of a Narrow Conflict: How Natural Resource Windfalls Shape Policy and Politics,The Journal of Politics,2018,https://www.journals.uchicago.edu/doi/abs/10.1086/694787,"Access to natural resources creates a political conflict between the expected economic winners and their environmental opponents, but the effects of such conflict on policy and politics remain unclear. To examine the scope of such effects, we exploit the rapid and unanticipated technological breakthroughs in the вЂњfrackingвЂќ of shale gas. During the past decade, shale gas production around the Marcellus Shale formation in the Northeastern United States expanded rapidly. Using a quasi-experimental design, we examine how access to shale gas in electoral districts changed the voting record of House Representatives on environmental policy relative to neighboring districts without access. Votes become 15вЂ“20 percentage points less likely to be in favor of the environment. The best explanation for this effect is the strong electoral performance of (anti-environmental) Republicans in shale-affected districts. The narrow conflict has a broad impact: access to natural resources puts downward pressure on environmental policy across the board.",maybe,no,legislative scorecard,government,,"LCV (League of Conservation Voters). 2013. “2013 National Environmental Scorecard: First Session of the 113th Congress.” Presented at the League of Conservation Voters, Washington, DC.",US House,2003 - 2011,no,yes,no,yes,,
Eggers2017,"Eggers, Andrew C.; Spirling, Arthur",Incumbency Effects and the Strength of Party Preferences: Evidence from Multiparty Elections in the United Kingdom,The Journal of Politics,2017,https://www.journals.uchicago.edu/doi/abs/10.1086/690617,"Previous researchers have speculated that incumbency effects are larger when voters have weaker partisan preferences, but evidence for this relationship is surprisingly weak. We offer a fresh look at the question by examining the United KingdomвЂ™s multiparty system. In general, the electoral value of incumbency should depend on the proportion of voters who are nearly indifferent between the parties competing for incumbency; in a multiparty system, that proportion may differ across constituencies depending on which parties are locally competitive. After first showing that UK voters in recent decades have stronger preferences between Conservatives and Labour than between Conservatives and Liberals, we show that incumbency effects are larger in close contests between Conservatives and Liberals than in close contests between Conservatives and Labour. By documenting how partisanship influences incumbency effects, our analysis shows that the comparative study of incumbency effects offers broader insights into electoral accountability across political systems.",no,,,,,,United Kingdom,,,,,,,"ananlysis of parties, not MPs"
Fraga2016,"Fraga, Bernard L.",Redistricting and the Causal Impact of Race on Voter Turnout,The Journal of Politics,2016,https://www.journals.uchicago.edu/doi/abs/10.1086/683601,"Recent work challenges traditional understandings of the link between race and voter turnout, suggesting that there is limited evidence of increased minority voting due to co-ethnic representation and majority-minority districts. Here I examine 65.3 million registration records from 10 states to trace individual-level participation before and after the 2012 round of redistricting, testing whether a shift in congressional representation, candidacy, and/or district ethnic composition affected an individualвЂ™s decision to participate. Separating results for non-Hispanic white, black, Latino, and Asian American registrants, I find that individuals change their behavior in response to ethnoracial context, with African Americans more likely to vote when assigned to majority-black districts with black candidates or incumbents. White and Asian registrants also turn out in higher numbers when a co-ethnic candidate is on the ballot, but Latinos may be less likely to vote in the short term when assigned to majority-Latino districts.",no,no,scholarly (database),scholarly,,"Catalist LLC database;
 Census 2010 voting-age population (VAP)",US,2006 - 2012,yes,no,yes,yes,,state legislators
Henderson2016,"Henderson, John; Brooks, John",Mediating the Electoral Connection: The Information Effects of Voter Signals on Legislative Behavior,The Journal of Politics,2016,https://www.journals.uchicago.edu/doi/abs/10.1086/685380,"We develop and assess an information account of representation. Accordingly, politicians face uncertainty about voter opinion and use previous vote margins to gauge future electoral outcomes. Losses in vote support elicit ideological moderation given new information about electorates. To test this account, we use rain around Election Day as a natural experiment in voting in the US House races from 1956 to 2008. We find that each additional inch of rainfall exogenously dampens Democratic vote margins by 1.4вЂ“2.0 percentage points and shifts incumbents rightward in their roll call positions in subsequent Congresses. We find responsiveness mainly in competitive districts with the greatest risk of defeat, and by Democrats rather than Republicans, suggesting an asymmetry in party representation. Overall, we highlight the importance of elite information uncertainty as a mechanism driving the electoral connection, and we show that idiosyncratic electoral effects can meaningfully impact legislative behavior.",maybe,no,"journalistic, scholarly","journalistic, scholarly",,"Congressional Quarterly 2014;
 Adler, E. Scott. 2012. “Congressional District Data File.” Computer file;
 Caughey, Devin, and Jas Sekhon. 2011. “Elections and the Regression-Discontinuity Design: Lessons from Close U.S. House Races, 1942–2008.” Political Analysis 19:385–408",US House,1956 - 2008,yes,yes,yes,yes,aggregate rainfall,
Hershberger2018,"Hershberger, Ethan; Minozzi, William; Volden, Craig",Party Calls and Reelection in the US Senate,The Journal of Politics,2018,https://www.journals.uchicago.edu/doi/abs/10.1086/698662,"Minozzi and Volden advance the idea that a substantial portion of partisan voting activity in Congress is a simple call to unity that is especially easily embraced by ideological extremists. If correct, Minozzi and VoldenвЂ™s findings should extend from the House to the Senate, despite differences in institutional structures and in tools at the disposal of party leaders across the two chambers. We adapt the theory and measurement of party calls to the Senate. In so doing, we find that both the House and the Senate have relied heavily (and increasingly) on party calls over the past four decades. In the Senate in particular, the lens of party calls opens new opportunities for scholars to explore partisan legislative behavior. We take advantage of one such opportunity to show how electoral concerns limit senatorsвЂ™ responsiveness to party calls, depriving party leaders of support for their agenda items.",maybe,no,scholarly,scholarly,,Legislative Effectiveness Project (Volden and Wiseman 2014),US House US Senate,1973 - 2012,no,yes,yes,no,responsiveness to party calls,"what category of variables is ""responsiveness to party calls""?"
Kalla2018,"Kalla, Joshua; Rosenbluth, Frances; Teele, Dawn Langan","Are You My Mentor? A Field Experiment on Gender, Ethnicity, and Political Self-Starters",The Journal of Politics,2018,https://www.journals.uchicago.edu/doi/abs/10.1086/693984,"Do public officials respond unequally to requests for career advice? Through a correspondence experiment with 8,189 officials, we examine whether (hypothetical) male and female students who express interest in political careers receive differential responses from public officials. We report three striking findings. First, emails sent by female students were more likely to receive a response than those sent by male students, especially when the official was male. Second, the responses that women received were as likely to be long, thoughtful, and contain an offer of help as those to men. Third, there were no partisan differences in responsiveness to male or female senders. Examining senders with Hispanic last names bolsters the results: Hispanic senders, especially men, were less likely to receive a quality response than non-Hispanic senders. Thus, politicians may condition responsiveness and helpfulness on the ethnicity of constituents, but women who are self-starters in search of advice receive equal treatment.",maybe,yes,"scholarly, original","scholarly, original",,New Organizing Institute,US,2014,yes,no,no,no,,
Lawless2018,"Lawless, Jennifer L.; Theriault, Sean M.; Guthrie, Samantha","Nice Girls? Sex, Collegiality, and Bipartisan Cooperation in the US Congress",The Journal of Politics,2018,https://www.journals.uchicago.edu/doi/abs/10.1086/698884,"When women in Congress solve a high-profile problem, their colleagues and the media praise their ability to get WashingtonвЂ™s business done by collaborating and compromising in a way that men do not. The problem with this popularly held view is that it is entirely anecdotal. In assembling several new data sets to test this proposition systematically, we find that women are more likely than men to participate in the kinds of activities that foster collegiality. But we uncover almost no evidence that womenвЂ™s legislative behavior on fact finding abroad, cosponsoring legislation, or engaging the legislative process differs from menвЂ™s. The partisan divide that now characterizes the legislative process creates strong disincentives for women (and men) to engage in bipartisan problem solving. To be sure, womenвЂ™s presence in Congress promotes democratic legitimacy, but it does little to reduce gridlock and stalemate on Capitol Hill.",maybe,no,original,original,,"The website of the Congressional Women’s Softball Game http://hoh.rollcall.com/congressional-womens-softball-game-2015-list-of-players/;
 http://hoh.rollcall.com/democrats-win-7th-straight-congressional-baseball-game/?dcz;
 Alducin, Alexander, Sean Q. Kelly, David C. W. Parker, and Sean M. Theriault. 2014. “Foreign Junkets or Learning to Legislate? Generational Changes in the International Travel Patterns of HouseMembers, 1977–2012.” Forum 12 (3): 563–77;
 The Lugar Center http://www.thelugarcenter.org/ourwork-Bipartisan-Index.html;
 Jessee, Stephen A., and Sean M. Theriault. 2014. “The Two Faces of Congressional Roll-Call Voting.” Party Politics 20 (6): 836–48;
 Dave Rohde’s PIPC database;
 http://www.senate.gov/legislative/votes.htm;
 http://www.cawp.rutgers.edu/fact-sheet-archive-women-congress;
 The Almanac of American Politics",US House US Senate,,yes,yes,yes,yes,social engagement (participation in activities with colleagues); congressional delegations,different years covered for diferent parts of analysis
Lee2018,"Lee, Frances E.",The 115th Congress and Questions of Party Unity in a Polarized Era,The Journal of Politics,2018,https://www.journals.uchicago.edu/doi/abs/10.1086/699335,"Given the size of their majorities and their level of voting cohesion, Republicans in the 115th Congress saw unified government under President Trump as a historic opportunity to enact their partyвЂ™s priorities. Yet the legislative record of the 115th Congress has been less impressive than that of other recent majority parties in control of unified government. This article considers why a party that seemed so well positioned to deliver on its agenda has struggled to do so. It argues that the 115th CongressвЂ™s modest level of legislative achievement reflects a majority party that is much less internally unified on policy than its roll-call voting cohesion would suggest. The case of the 115th Congress invites scholars to reexamine their reliance on vote-based measures of party unity.",no,no,"journalistic, scholarly","journalistic, scholarly",,"Nexis Uni news database;
 Brookings Institution. 2017. “Vital Statistics on Congress.” Brookings, September 7. https://www.brookings.edu/multi-chapter-report/vital-statistics-on-congress/",US House US Senate,1992 - 2017,no,yes,yes,no,,Nexis Uni news database - journalistic or scholarly?; estimation of majority unity based on roll call votes - is it aggregate voting patterns that we are not interested in?; news coverage about disputes inside of the party are we interested? IN THE DATA MATERIALS THERE ARE NO INFO ABOUT INDIVIDUAL POLITICIANS
Martin2018,"Martin, Gregory J.",Dividing the Dollar with Formulas,The Journal of Politics,2018,https://www.journals.uchicago.edu/doi/abs/10.1086/694544,"In advanced democracies, most government spending is allocated according to criteria approved by a legislature but implemented by the bureaucracy. I ask whether this fact imposes a binding constraint on the ability of legislators to engage in targeted redistribution, by constructing a model in which legislators are constrained to allocate spending by a formula of limited dimensionвЂ”in contrast to benchmark models where proposers have the flexibility to manipulate the payoffs of individual members directly. The model predicts oversized winning coalitions, positive distributions outside of the winning coalition, and the emergence of persistent voting blocs. I then apply the model to a sample of 31 US federal spending bills, using new data connecting spending outcomes to authorizing legislation. I find that most allocation formulas for spending programs involve five or fewer factors. Formulaic allocation imposes a tight constraint on targeting, eliminating more than 90\% of congressional proposersвЂ™ degrees of freedom.",maybe,no,,,,,US House US Senate,,no,yes,yes,yes,roll-call vote of each district on each bill; at-large district; Senate: Delegation split,check ap.E in the uni for data sources and years; check ap.D in the uni for covariates; roll-call vote of each district on each bill is the same as congressional district representative (i.e. national legislator)? So are we interested?
Michelitch2018,"Michelitch, Kristin; Utych, Stephen",Electoral Cycle Fluctuations in Partisanship: Global Evidence from Eighty-Six Countries,The Journal of Politics,2018,https://www.journals.uchicago.edu/doi/abs/10.1086/694783,"Elections are defining elements of democracy but occur infrequently. Given that elections evoke mass mobilization, we expect citizen attachments to political parties to wax during election season and wane in between. By leveraging data from 86 countries across the globe to investigate the effect of the electoral cycle on partisanship, we find that the predicted probability of being close to a political party rises 6 percentage points from cycle midpoint to an electionвЂ”an effect rivaling traditional key determinants of partisanship. Further, fluctuations are larger where the persistence of party presence throughout the cycle is weaker and socioeconomic development is lower. These findings challenge the discipline to introduce dynamic political events into the study of partisanship, alongside вЂњstaticвЂќ individual-level and country-level determinants. Additionally, presumed cross-country or temporal differences in mass partisanship levels, long used as indicators of democratic consolidation or party system institutionalization, may be confounded by electoral cycle effects.",no,,,,,,,,,,,,,
Montgomery2017,"Montgomery, Jacob M.; Nyhan, Brendan",The Effects of Congressional Staff Networks in the US House of Representatives,The Journal of Politics,2017,https://www.journals.uchicago.edu/doi/abs/10.1086/690301,"Standard accounts of legislative behavior typically neglect the activities of professional staff, who are treated as extensions of the elected officials they serve. However, staff appear to have substantial independent effects on observed levels of legislator productivity and policy preferences. In this article, we use a novel data set of comprehensive longitudinal employment records from the US House of Representatives to estimate the effects of congressional staff on legislative behavior. Specifically, results from a series of heteroskedastic Bayesian spatial autoregressive models indicate that members of Congress who exchange important staff members across congresses are more similar in their legislative effectiveness and voting patterns than we would otherwise expect. These findings suggest that scholars should reconsider the role of staff in the legislative process.",yes,no,"scholarly, journalistic","scholarly, journalistic",,"Volden and Wiseman 2014, 18 http://www.thelawmakers.org/##/method;
 CQ First Street, an electronic database that was created by digitizing the print CQ Press Directories from 1993 to 2009 and then updating the data during the subsequent period",US House,1997 - 2011,yes,yes,yes,no,legislative effectiveness scores (LES); senior or senior/policy staff ties (networks),CQ First street database - scholarly or journalistic?
