AuthorYear,Authors,Title,Journal,Year,URL,Abstract,Relevant,Experiment,SourceType,SourceTypeNEW,Original,DataSourceReference,Country,YearsCovered,VarsSocioDemographic,VarPolBehavior,VarsOffices,VarsDistrict,VarsInteresting,Questions?
LAZARUS2009,"LAZARUS, J. E. F. F. R. E. Y. STEIGERWALT, A. M. Y.",Different Houses: The Distribution of Earmarks in the U.S. House and Senate,LSQ,2009,http://www.jstor.org/stable/20680246,"Nearly all studies of pork-barrel politics in the U.S. Congress focus on the House, biasing our conception of how politics influences federal spending and skewing our attention toward factors that are active in the House. This article highlights differences between the Senate and House in how pork is allocated. We identify four important differences between the House and Senate, generate hypotheses regarding how each difference should influence the distribution of pork projects, and test these hypotheses using data from earmarks in the Appropriations bills passed by the two chambers for fiscal year 2008. The results support three of our four hypotheses, suggesting that senators are driven by different motivations than House members.These results imply that theoretical accounts of pork-barrel spending need to account for these interchamber differences. Our findings also highlight how studies of legislative behavior, more generally, need to account for important differences in legislative structure and organization.",yes,no,institute,institute,,"Taxpayers for Common Sense. 2007. ""Taxypayers for Common Government Work."" www",US House US Senate,2008,no,yes,yes,yes,earmarks,
LEVENDUSKY2010,"LEVENDUSKY, M. A. T. T. H. E. W. S. JEREMY C., P. O. P. E.",Measuring Aggregate-Level Ideological Heterogeneity,LSQ,2010,http://www.jstor.org/stable/25750382,"Ideological heterogeneity is a key variable for the study of legislative and electoral politics. Scholars have long recognized that members with more ideologically heterogeneous constituencies behave differently than members with more homogeneous ones. Empirical tests of these theories, however, have typically been stymied by a lack of appropriate measures. We corrected this shortcoming by developing a measurement model for ideological heterogeneity, and we used our method to generate estimates for the 50 U.S. states and 435 congressional districts. Beyond the specific results presented here, a key contribution of our model is its flexibility: our technique can be used to produce similar estimates in a variety of contexts.",no,no,scholarly,scholarly,,"Ansolabehere, Stephen. 2006. ""Cooperative Congressional Election Study?Common Content Module."" http://web.mit.edu/polisci/portl/cces/commoncontent.htm",United States,,no,no,no,yes,,"study focuses on heterogeneity in electoral districts, not on legislators' behavior"
LINDSTAeDT2011,"LINDST{\A}DT "" REN{\'E} SLAPIN"" "" J. O. N. A. T. H. A. N. B. WIELEN"" R. Y. A. N. J. V. A. N. D. E. R.""",Balancing Competing Demands: Position Taking and Election Proximity in the European Parliament,,2011,https://www.jstor.org/stable/23053238,"Parties value unity, yet members of parliament have incentives to deviate from the party line. This article examines how members of the European Parliament (EP) respond to competing demands from national parties and European party groups. We examine ideological shifts within a single parliamentary term to assess how election proximity affects party group cohesion. Our formal model of legislative behavior suggests that when EP elections are proximate, national party delegations shift toward national party positions, thus weakening EP party group cohesion. Our Bayesian item-response analysis of roll calls in the 5th EP supports our theoretical predictions.",yes,no,unclear,scholarly,,unclear,European Parliament,1999-2004,no,yes,yes,no,,
Loewen2014,"Loewen, Peter John Koop, Royce Settle, Jaime Fowler, James H.",A Natural Experiment in Proposal Power and Electoral Success,AJPS,2014,http://www.jstor.org/stable/24363477,"Does lawmaker behavior influence electoral outcomes? Observational studies cannot elucidate the effect of legislative proposals on electoral outcomes, since effects are confounded by unobserved differences in legislative and political skill. We take advantage of a unique natural experiment in the Canadian House of Commons that allows us to estimate how proposing legislation affects election outcomes. The right of noncabinet members to propose legislation is assigned by lottery. Comparing outcomes between those who were granted the right to propose and those who were not, we show that incumbents of the governing party enjoy a 2.7 percentage point bonus in vote total in the election following their winning the right to introduce a single piece of legislation, which translates to a 7% increase in the probability of winning. The causal effect results from higher likeability among constituents. These results demonstrate experimentally that what politicians do as lawmakers has a causal effect on electoral outcomes.",yes,no,government,government,,Legislative and electoral records of incumbents serving in the Canadian Parliament,Canada,2004-2008,no,yes,yes,no,,
MACDONALD2010,"MACDONALD, J. A. S. O. N. A.",Limitation Riders and Congressional Influence over Bureaucratic Policy Decisions,APSR,2010,http://www.jstor.org/stable/40982896,"Limitation riders, which allow the U.S. Congress to forbid agencies from spending money for specific uses, enable congressional majorities to exert greater influence over bureaucratic policy decisions than is appreciated by research on policy making in the United States. I develop a theory of limitation riders, explaining why they lead to policy outcomes that are preferable to a majority of legislators compared to outcomes that would occur if this tool did not exist. I assess this perspective empirically by analyzing the volume of limitation riders reported in bills from 1993 to 2002 and all limitation riders forbidding regulatory actions from 1989 to 2009. In addition to supporting the conclusion that Congress possesses more leverage over agencies' decisions than is currently appreciated, the findings have implications for advancing theories of delegation.",maybe,no,government,government,,THOMAS (Library of Congress' legislation information page): www.thomas.gov,US House US Senate,1993-2002,no,yes,no,no,,
Madonna2011,"Madonna, Anthony J.",Winning Coalition Formation in the U.S. Senate: The Effects of Legislative Decision Rules and Agenda Change,AJPS,2011,http://www.jstor.org/stable/23025051,"Recent empirical work has brought a renewed attention to the effect congressional rules of procedure have on the size of winning coalitions. Specifically, scholars have posited that legislative success hinges on the support of legislators identified by institutionally defined decision rules. Under these theories, supermajority decision rules in the U.S. Senate lead to larger, more inclusive coalitions on final passage. In this article, I reevaluate these claims by controlling for changes in the legislative agenda and the roll-call voting record. I find that the aggregate size of winning coalitions is highly responsive to the underlying legislative agenda, the size of the Senate's majority party, and the manner in which researchers treat unrecorded votes. Further, my findings suggest that any connection between changes in the Senate's voting rules and the size of winning coalitions is spurious.",yes,no,scholarly,scholarly,,"Stathis, Stephen W. 2003. Landmark Legislation 1774-2002: Major U.S. Acts and Treaties. Washington, DC: CQ Press; Peterson, R. Eric. 2001. ""Is It Science Yet? Replicating and Val idating the Divided We Govern List of Important Statutes."" Presented at the annual meeting of the Midwest Political Science Association.",US Senate,1865-1946,no,yes,no,no,,
Mahoney2015,"Mahoney, Christine Baumgartner, Frank R.",Partners in Advocacy: Lobbyists and Government Officials in Washington,JOP,2015,http://www.jstor.org/stable/10.1086/678389,"One of the most important demonstrations of power in Washington is the ability to recruit sitting government officials to become active proponents of one's position. Many have suggested money is the key: Campaign contributions buy friends, access, and perhaps even policy activism. We provide an alternative view based on a deceptively simple observation: Lobbyists rarely lobby alone. We show empirically that government policymakers respond to the overall structure of conflict, not the resources of individual lobbying groups. Our project is based on in-depth interviews with over 300 policy advocates and systematic information on each of more than 2,000 advocates playing a significant role in a random sample of 98 policy issues in the United States federal government from 1999 to 2002.",maybe,no,scholarly,scholarly,,"Baumgartner, Frank R., Jeffrey M. Berry, Marue Hojnacki, David C. Kimball, and Beth L. Leech. 2009. Lobbying and Policy Change: Who Wins, Who Loses, and Why. Chicago: University of Chicago Press.",US House US Senate,1999-2002,no,yes,yes,no,,
MALESKY2010,"MALESKY, E. D. M. U. N. D. SCHULER, P. A. U. L.",Nodding or Needling: Analyzing Delegate Responsiveness in an Authoritarian Parliament,APSR,2010,http://www.jstor.org/stable/40863765,"Recent scholarship argues that one solution to ensure longevity and economic growth in an authoritarian regime is to co-opt potential opposition by offering them limited policy influence in a national legislature. Although cooptation theory generates a number of predictions for delegate behavior within an authoritarian parliament, the opacity of such regimes has made empirical confirmation difficult. We resolve this problem by exploiting the transcripts of query sessions in the Vietnamese National Assembly, where delegates question the prime minister and Cabinet members on important issues of the day. Using a content analysis of queries, we offer the first empirical test of delegate behavior in nondemocratic parliaments. We find that some delegates exhibit behavior consistent with cooptation theory by actively participating in sessions, demonstrating criticism of authorities, and responding to the needs of local constituents. Such responsiveness, however, is parameterized by regime rules for nominating, electing, and assigning parliamentary responsibilities to individual delegates.",yes,no,"scholarly, government",scholarly,,"Malesky, Edmund, and Paul Schüler. 2009. ""Paint-by-numbers Democracy: The Stakes, Structure, and Results of the 2007 Viet- namese National Assembly Election."" Journal of Vietnamese Stud- ies 4 (1): 1-48.; Office of National Assembly",Vietnam,2007-2012,yes,yes,yes,yes,,
MALESKY2012,"MALESKY, E. D. M. U. N. D. SCHULER, P. A. U. L. ANH, T. R. A. N.",The Adverse Effects of Sunshine: A Field Experiment on Legislative Transparency in an Authoritarian Assembly,APSR,2012,http://www.jstor.org/stable/23357708,"An influential literature has demonstrated that legislative transparency can improve the performance of parliamentarians in democracies. In a democracy, the incentive for improved performance is created by voters' responses to newly available information. Building on this work, donor projects have begun to export transparency interventions to authoritarian regimes under the assumption that nongovernmental organizations and the media can substitute for the incentives created by voters. Such interventions, however, are at odds with an emerging literature that argues that authoritarian parliaments primarily serve the role of co-optation and limited power sharing, where complaints can be raised in a manner that does not threaten regime stability. We argue that under these conditions, transparency may have perverse effects, and we test this theory with a randomized experiment on delegate behavior in query sessions in Vietnam, a single-party authoritarian regime. We find no evidence of a direct effect of the transparency treatment on delegate performance however, further analysis reveals that delegates subjected to high treatment intensity demonstrate robust evidence of curtailed participation and damaged reelection prospects. These results make us cautious about the export of transparency without electoral sanctioning.",yes,yes,original,original,,Self-collected,Vietnam,2010,yes,yes,yes,yes,,
MARTIN2011,"MARTIN, S. H. A. N. E.","Electoral Institutions, the Personal Vote, and Legislative Organization",LSQ,2011,http://www.jstor.org/stable/23053246,"What is the relationship between electoral institutions and the internal organization of legislatures? Existing research on the U.S. Congress suggests that electoral incentives shaped by the candidate-centered nature of congressional elections explain the emergence of strong committees in that legislature. Exploring the issue from a comparative perspective, it is argued that the impact of ballot structure on committee system structure is dependent on how legislators cultivate personal votes. Committees will be stronger when legislators supply fiscal legislative particularism (pork), but weaker when legislators cultivate support by delivering extra-legislative constituency service. Statistical analysis, combining original data on committee design in 39 democratic legislatures with measures of ballot structure and mechanism to cultivate a personal vote (MCPV), confirms the expectation.",maybe,no,scholarly,scholarly,,"Johnson, Joel W., and Jessica S. Wallack. 2010. Database of Electoral Systems and the Personal Vote. Available at: http://polisci2.ucsd.edu/jwjohnson/espv; International Instutute for Democracy and Electoral Assistance","Multiple,",,no,yes,no,no,,
Matsubayashi2013,"MATSUBAYASHI, T. E. T. S. U. Y. A.",Do Politicians Shape Public Opinion?,BJPS,2013,http://www.jstor.org/stable/23526236,"Most research on political representation focuses on how citizens' ideology and partisanship influence their support for political candidates — leaving the question of whether (and how) elected officials influence citizens' positions on political issues open to debate. The hypothesis tested here — using a unique, quasi-experimental design with American National Election Study data between 1956 and 2004 — is that Democratic representatives shift the opinions of constituents in the pro-Democratic and liberal direction, while Republican representatives shift constituents' opinions in the pro-Republican and conservative direction. The findings show that incumbent representatives indeed move their constituents' opinions in a particular direction, and that representatives have a stronger impact on constituents who are more frequently exposed to their messages.",no,,,,,,,,,,,,,"wasn't able to access this article online, it's not in the dropbox folder"
Mershon2013,"Mershon, Carol Shvetsova, Olga",The Microfoundations of Party System Stability in Legislatures,JOP,2013,http://www.jstor.org/stable/10.1017/s0022381613000716,"What sustains stability in legislative party systems between elections? This question commands attention given the potential for change highlighted in recent work on legislative party switching. In addressing the question, this article echoes a prominent theme in research on legislatures, parties, and party systems: the importance of the party label. The novelty here is the treatment of the individual legislator's need for manifest loyalty to the status quo party label as the chief constraint that deters incumbents from switching and underpins stability in legislative party systems. Our theory focuses on the value of stable party affiliations to voters and thus to incumbents as well. We extract testable implications and assess hypotheses against an original cross-national dataset of over 4,300 monthly observations of MP behavior in 116 legislative terms. We find that the temporal proximity to elections deters MPs' moves. This electoral deterrent acquires particular force under candidate-centered electoral systems",yes,no,scholarly,scholarly,,dx.doi.org/10.1017/S0022381613000716 andwww.carolmershon.weebly.com,"Multiple,",,no,no,yes,no,,
Meserve2009,"Meserve, Stephen A. Pemstein, Daniel Bernhard, William T.",Political Ambition and Legislative Behavior in the European Parliament,JOP,2009,http://www.jstor.org/stable/10.1017/s0022381609090859,"Members of the European Parliament (MEPs) typically follow one of two career paths, either advancing within the European Parliament itself or returning to higher offices in their home states. We argue that these different ambitions condition legislative behavior. Specifically, MEPs seeking domestic careers defect from group leadership votes more frequently and oppose legislation that expands the purview of supranational institutions. We show how individual, domestic-party, and national-level variables shape the careers available to MEPs and, in turn, their voting choices. To test the argument, we analyze MEPs' roll-call voting behavior in the 5th session of the EP (1999--2004) using a random effects model that captures idiosyncrasies in voting behavior across both individual MEPs and specific roll-call votes.",yes,no,government,government,,"European Union. 2006.‘‘Official Journal of the European Union.’’ http://europa.eu.int/eur-lex/lex/JOIndex.do (April 3, 2006).",European Parliament,1999-2004,yes,yes,yes,no,,
Micozzi2012,"Micozzi, Juan Pablo","Does Electoral Accountability Make a Difference? Direct Elections, Career Ambition, and Legislative Performance in the Argentine Senate",JOP,2012,http://www.jstor.org/stable/10.1017/s0022381612000928,"Studies analyzing the American Congress demonstrate that senators' attention towards voters substantially increased after the 17th Amendment to the U.S. Constitution, which replaced their indirect appointment with direct election. Even though this finding seems useful for theoretical generalizations, expectations become unclear as concerns about career perspectives differ. Should politicians with nonstatic ambition shift their attention towards voters if they do not expect reelection? Making use of a quasi-experimental setting, I analyze the impact of the shift from indirect to direct election to select the members of the Argentine Senate. I develop an argument for why, in spite of the lack of systematic pursuit of reelection, elected senators have incentives to be more oriented towards voters. Through the analysis of about 55,000 bills, I evaluate senatorial behavior under both sources of legitimacy. The findings support the idea that audience costs make a difference in behavior, regardless of short-term career expectations.",yes,no,government,government,,Argentine Congress' website (www.hcdn.gov.ar),Argentina,1984-2007,no,yes,yes,yes,territorial family member,
MILLER2010,"MILLER, S. U. S. A. N. M. OVERBY, L. M. A. R. V. I. N.","Parties, Preferences, and Petitions: Discharge Behavior in the Modern House",LSQ,2010,http://www.jstor.org/stable/25750379,"Although discharge petitions lie at the confluence of personal preferences, committee prerogatives, and party leadership in Congress, these procedures have received little scholarly scrutiny. We capitalize on the public nature of petition signatures since 1993 to examine the behavior of the most cross-pressured members in discharge battles: bill sponsors and cosponsors belonging to the majority party who personally prefer the bills they have sponsored but who face party pressure not to sign the petitions that threaten the leadership's control of the legislative agenda. After controlling for personal preferences, we find a statistically significant partisan effect in the U.S. House, which further illuminates the Where's the party?"" debate.""",yes,no,scholarly,scholarly,,,US House,1993-2006,no,yes,yes,no,,
MILLER2011,"MILLER, S. U. S. A. N. M. NICHOLSON-CROTTY, J. I. L. L. NICHOLSON-CROTTY, S. E. A. N.",Reexamining the Institutional Effects of Term Limits in U.S. State Legislatures,LSQ,2011,http://www.jstor.org/stable/23053239,"Research on term limits suggests that they have substantial consequences for the power of legislatures vis-{\`a}-vis the executive and interest groups and for the relationship between leaders and rank-and-file members within a chamber. Existing work, however, has not accounted for the actual power of relevant state actors. We contribute to this research by examining the effect of term limits on the influence of institutional actors conditional on the existing political power structure in a state. The inclusion of controls for the direct and moderating effect of actual institutional power suggests some significant extensions of previous findings regarding the institutional effects of term limits.",yes,no,scholarly,scholarly,,"Carey, John M., Richard G. Niemi, Lynda W. Powell, and Gary Moncrief. 2002. ;""State Legislative Survey."" Interuniversity Consortium for Political and Social Research. ICPSR 20960.; National Conference of State Legislators",US House US Senate,2002,yes,yes,yes,no,,
Minozzi2013,"Minozzi, William Volden, Craig",Who Heeds the Call of the Party in Congress?,JOP,2013,http://www.jstor.org/stable/10.1017/s0022381613000480,"When party leaders seek support, who heeds the call and who remains unswayed? The canonical error-free spatial model of voting predicts the targeting of fence-sitting moderates. In contrast, we advance a random-utility-based model of party calls, wherein legislators who benefit the most from a common party position respond to the call of party leaders. This model predicts that extremists will heed the call of the party more than moderates, even upon controlling for baseline rates of voting with the party. To test this prediction, we develop a new method to identify ``party-influenced votes,'' to generate estimates of ``party-free ideal points,'' and to examine rates of responsiveness to political parties across members in the House of Representatives between 1973 and 2006. We find that, contrary to common portrayals of party influence, those most responsive to their parties are not the chamber moderates. Rather, responsiveness is greatest for ideological extremists in both the majority and minority parties, declining significantly among more moderate members. This finding sets the stage for new theoretical and empirical work on the role of parties in Congress.",yes,no,scholarly,scholarly,,"Charles Stewart III and Jonathan Woon. Congressional Committee Assignments, 103rd to 110th Congresses, 1993--2007. http://web.mit.edu/cstewart/www/data/data_page.html; Other data constructed by authors based on data provided by Gary Jacobson, Almanac of American Politics, and Daniel Butler.",US House,1973-2006,yes,yes,yes,no,,
MINTA2009,"MINTA, M. I. C. H. A. E. L. D.",Legislative Oversight and the Substantive Representation of Black and Latino Interests in Congress,LSQ,2009,http://www.jstor.org/stable/20680236,"When determining whether or not legislators are representing their constituents' interests, scholars using voting studies may overstate the role of strategic factors, such as reelection goals and constituent influence, while understating the effect of descriptive characteristics. I argue that race and ethnicity matter in congressional oversight of bureaucratic policymaking. My examination of hearing transcripts from the 107th Congress indicates that minority legislators are more likely than white legislators to participate in racial-oversight hearings but not more likely than whites to participate in social welfare hearings. The results show that descriptive representation contributes to substantive representation, even if the costs of participating outweigh the electoral benefits.",maybe,no,government,government,,"U.S. Congress, various committees, various hearings",US House US Senate,2001-2002,yes,yes,no,yes,,
NOKKEN2013,"NOKKEN, T. I. M. O. T. H. Y. P.","Uncertainty and Roll-Call Voting in Lame-Duck Sessions of the U.S. House, 1969-2010",LSQ,2013,http://www.jstor.org/stable/42703820,"Lame-duck sessions of Congress have become increasingly common of late. Such sessions are marked by higher levels of ideological and participatory shirking among departing members, creating a more uncertain legislative environment. I investigate the consequences of such shirking on coalition formation and roll-call behavior. I analyze House roll-call votes held in the 12 congresses that convened lame-duck sessions from 1969 to 2010 (91st to 11 lth Congresses) to assess how roll-call behavior changes across sessions. I find subtle but statistically significant changes across sessions consistent with claims regarding greater uncertainty in roll-call voting in lame-duck sessions.",yes,no,institute,scholarly,,"PIPC roll call data, available at voteview.com",US House US Senate,1969-2010,no,yes,no,no,lame duck dummy,
OBRIEN2013,"O'BRIEN, D. I. A. N. A. Z. SHOMER, Y. A. E. L.",A Cross-National Analysis of Party Switching,LSQ,2013,http://www.jstor.org/stable/42703791,"Though instances of party switching have been widely documented, there is little cross-national research on this phenomenon. The prevalence of switching is therefore unknown, and the factors influencing this behavior remain unclear. Using the most comprehensive dataset on party switching ever constructed, we illustrate both that interparty movement is more common than previously assumed and that there are substantial differences in its prevalence across parties. To explain this variation, we examine the relationship between legislators' motivations, institutional arrangements, and switching. We find that motivational explanations are correlated with interparty movement and that institutional arrangements exhibit only limited direct influence on switching.",yes,no,unclear,scholarly,,unclear,"multiple,",,no,yes,yes,yes,"% switchers, rice score",
